{
 "format": "benchcad-case/1",
 "id": "case1",
 "env": "t1_drawing2part",
 "kind": "part",
 "family": null,
 "units": "mm",
 "synthetic": false,
 "source": {
  "repo": "drawings",
  "split": "example"
 },
 "input": [
  {
   "path": "input/drawing.pdf",
   "sha256": "b2c427862957dc5c822660338438bcd6ba2d62de218e06158e77aee4b4649db6"
  }
 ],
 "gt": [
  {
   "path": "gt/gt.step",
   "sha256": "c7072e835bca45fa40e4e04eec7bd73ea3ae279b7c318a564f7bcbd4182caadf"
  }
 ],
 "generator": {
  "tool": "tools/migrate_case.py",
  "dev_sample": {
   "tool": "tools/make_dev_samples.py",
   "from": "t1_drawing2part",
   "note": "A copy of a real case with provenance/ (and, for the ECAD cases, alignment/) left out, and every PDF Info dictionary cleared. References to provenance/... in `notes` or `redaction.note` are the source case's own words and point at files that are deliberately not shipped. expected.json holds the scores this sample must reproduce."
  }
 },
 "gates": {},
 "redaction": {
  "status": "clean",
  "note": "Standard BenchCAD T1 title block reading CASE 1; no source drawing numbers; PDF Info dictionary cleared in this copy; page content outside the title block untouched. Full note: provenance/case.source.json."
 },
 "notes": "Mounting bracket. See provenance/README.md and provenance/SOURCE_CAVEAT.txt; drawing-to-STEP agreement not certified."
}
